{
  "slug": "{{SLUG}}",
  "title": "{{TITLE}}",
  "sub": "Agent-generated local wiki · {{DATE}}",
  "description": "A local SiliWiki content pack generated by a human or local agent.",
  "logoText": "{{LOGO}}",
  "version": "v0.1",
  "updated": "{{DATE}}",
  "accent": "#5b3df5",
  "accentSoft": "#ece8ff",
  "accentDark": "#3720c9",
  "disclaimer": "Local-first wiki pack. Verify sources before sharing externally.",
  "nav": [
    {
      "chip": "1",
      "title": "Overview",
      "open": true,
      "children": [
        { "anchor": "what-this-is", "title": "What this is" },
        { "anchor": "why-it-matters", "title": "Why it matters" }
      ]
    },
    {
      "chip": "2",
      "title": "Knowledge Map",
      "open": true,
      "children": [
        { "anchor": "core-concepts", "title": "Core concepts" },
        { "anchor": "open-questions", "title": "Open questions" }
      ]
    }
  ]
}
