{
  "slug": "valmet-lca-ontology-case-study",
  "title": "Valmet 五年本体驱动 LCA 诊断",
  "sub": "公司画像 · Ontology extraction · Evidence Objects · Scope 3 hotspot · 2026-05",
  "description": "一份中文 Valmet 五年本体驱动 LCA case study：从公司画像、业务模式、Scope 3 热点、LCA claim、assurance 与 missing evidence 出发，展示 ontology-managed extraction 如何把企业披露转成可审计证据对象。",
  "logoText": "VAL",
  "version": "v0.2",
  "updated": "2026-05-13",
  "accent": "#0f766e",
  "accentSoft": "#ccfbf1",
  "accentDark": "#115e59",
  "disclaimer": "研究型 case study。证据来自 source-grounded extraction 与公开/本地报告文本，但在外部 LCA、投资或 assurance 场景使用前仍需要专家复核。",
  "nav": [
    {
      "chip": "1",
      "title": "问题与公司",
      "open": true,
      "children": [
        {
          "anchor": "research-question",
          "title": "研究问题"
        },
        {
          "anchor": "company-profile",
          "title": "公司画像"
        },
        {
          "anchor": "company-selection",
          "title": "为什么选择 Valmet"
        },
        {
          "anchor": "company-assessment",
          "title": "公司评价"
        },
        {
          "anchor": "ontology-design",
          "title": "Ontology 设计"
        }
      ]
    },
    {
      "chip": "2",
      "title": "抽取结果",
      "open": true,
      "children": [
        {
          "anchor": "extraction-results",
          "title": "Extraction run"
        },
        {
          "anchor": "concept-coverage",
          "title": "概念覆盖"
        },
        {
          "anchor": "audit-flags",
          "title": "审计标记"
        }
      ]
    },
    {
      "chip": "3",
      "title": "LCA 诊断",
      "open": true,
      "children": [
        {
          "anchor": "lca-scorecard",
          "title": "LCA scorecard"
        },
        {
          "anchor": "metric-table",
          "title": "五年指标表"
        },
        {
          "anchor": "diagnosis",
          "title": "诊断结论"
        },
        {
          "anchor": "evidence-ledger",
          "title": "证据台账"
        }
      ]
    },
    {
      "chip": "4",
      "title": "复现与迭代",
      "open": true,
      "children": [
        {
          "anchor": "limitations",
          "title": "方法限制"
        },
        {
          "anchor": "raw-artifacts",
          "title": "可复现文件"
        },
        {
          "anchor": "next-steps",
          "title": "下一步"
        },
        {
          "anchor": "changelog",
          "title": "更新记录"
        }
      ]
    }
  ]
}
